{
  "schemaVersion": 1,
  "accountOwner": "chrissotraidis",
  "source": {
    "name": "Pad Ports",
    "subtitle": "Audited iPhone and iPad game ports",
    "description": "Audited iPhone and iPad apps linked from project-owned releases; import or build your own game data where the project requires it.",
    "tintColor": "#5856D6"
  },
  "projects": [
    {
      "id": "agepad",
      "name": "AgePad",
      "repository": {
        "slug": "chrissotraidis/agepad",
        "defaultBranch": "main",
        "revision": "e0f8cf0cebceb621e671c04945a899be24e099a3",
        "checkoutDirectory": "agepad",
        "checkoutPolicy": "default",
        "submodules": "none"
      },
      "technical": {
        "status": "manualBuild",
        "note": "A public IPA exists, but the README warns that Steam compatibility/account safety are unconfirmed and describes modifying local Steam client/SDK files."
      },
      "legal": {
        "spdxExpression": "NOASSERTION",
        "distributionReview": "blocked",
        "rehostAllowed": false,
        "note": "A public IPA exists, but the README warns that Steam compatibility/account safety are unconfirmed and describes modifying local Steam client/SDK files."
      },
      "build": {
        "state": "manual",
        "recipe": null,
        "runner": "manual/local",
        "brewPackages": [],
        "expectedBundleIdentifier": null
      },
      "altStore": {
        "status": "excluded",
        "delivery": "none",
        "exclusionReasons": [
          "licenseAndSteamIntegrationReviewRequired"
        ],
        "app": null,
        "versions": []
      }
    },
    {
      "id": "annepad",
      "name": "AnnePad",
      "repository": {
        "slug": "chrissotraidis/annepad",
        "defaultBranch": "main",
        "revision": "3f476142b88655d56eb04972f1db2cb65fc42b20",
        "checkoutDirectory": "annepad",
        "checkoutPolicy": "default",
        "submodules": "recipe"
      },
      "technical": {
        "status": "buildRecipeReady",
        "note": "The repository has a ROM-free unsigned iOS packaging path."
      },
      "legal": {
        "spdxExpression": "NOASSERTION",
        "distributionReview": "approvedForDirectLink",
        "rehostAllowed": false,
        "note": "Use a hash-pinned project-owned release asset only; do not mirror until the recompilation and frontend grants are complete."
      },
      "build": {
        "state": "ready",
        "recipe": "recipes/annepad/build.sh",
        "runner": "macos-15",
        "brewPackages": [
          "cmake",
          "ninja"
        ],
        "expectedBundleIdentifier": "com.chrissotraidis.annepad"
      },
      "altStore": {
        "status": "excluded",
        "delivery": "none",
        "exclusionReasons": [
          "upstreamIPAWithdrawn"
        ],
        "app": {
          "name": "AnnePad",
          "developerName": "AnnePad contributors",
          "subtitle": "Pokemon Stadium rebuilt for iPhone and iPad",
          "localizedDescription": "A native arm64 static recompilation with Metal presentation and touch controls. The IPA contains no ROM; supply game data you are authorized to use inside the app.",
          "category": "games",
          "tintColor": "#C34B62",
          "iconURL": "https://raw.githubusercontent.com/chrissotraidis/annepad/73309971bbc250be4d50a43adbcdc64988e681de/apple/app/Assets.xcassets/AppIcon.appiconset/AppIcon-1024.png"
        },
        "versions": [
          {
            "tag": "v0.1.0-preview.2",
            "sourceRevision": "73309971bbc250be4d50a43adbcdc64988e681de",
            "pageURL": "https://github.com/chrissotraidis/annepad/releases/tag/v0.1.0-preview.2",
            "assetName": "AnnePad-0.1.0-preview.2-unsigned.ipa",
            "downloadURL": "https://github.com/chrissotraidis/annepad/releases/download/v0.1.0-preview.2/AnnePad-0.1.0-preview.2-unsigned.ipa",
            "publishedAt": "2026-08-06T09:32:38Z",
            "size": 85316453,
            "sha256": "7de5fcc85824babbea83f1436fc7c10f70a17b17aed28fe422d5fadb4f3282c9",
            "versionDescription": "Project-owned AnnePad preview 2 unsigned arm64 IPA, audited as an iPhoneOS build with no recognized game-data files.",
            "audit": {
              "bundleIdentifier": "com.chrissotraidis.annepad",
              "version": "0.1.0",
              "buildVersion": "1",
              "minimumOS": "16.0",
              "deviceFamilies": [
                1,
                2
              ],
              "architectures": [
                "arm64"
              ],
              "supportedPlatforms": [
                "iPhoneOS"
              ],
              "entitlements": [],
              "privacy": {},
              "machOCount": 1,
              "embeddedFrameworkCount": 0,
              "maximumEntryCount": 100,
              "maximumUncompressedSize": 500000000,
              "forbiddenGameDataExtensions": [
                "z64",
                "n64",
                "v64",
                "rom",
                "iso",
                "gcm",
                "rvz",
                "mpq"
              ]
            }
          }
        ]
      }
    },
    {
      "id": "ballpad",
      "name": "BallPad",
      "repository": {
        "slug": "chrissotraidis/ballpad",
        "defaultBranch": "main",
        "revision": "9dea0fe233061d61ee0dfbac82849d4f126c8199",
        "checkoutDirectory": "ballpad",
        "checkoutPolicy": "default",
        "submodules": "none"
      },
      "technical": {
        "status": "manualBuild",
        "note": "Current public release contains a PadMint recipe, not an installable IPA; PadMint builds a private app from user-supplied game data."
      },
      "legal": {
        "spdxExpression": "GPL-3.0",
        "distributionReview": "upstreamLinkOnly",
        "rehostAllowed": false,
        "note": "No rehosting approval. Keep any future release linked to the project owner after source, artwork, trademark, and game-data review."
      },
      "build": {
        "state": "manual",
        "recipe": null,
        "runner": "manual/local",
        "brewPackages": [],
        "expectedBundleIdentifier": null
      },
      "altStore": {
        "status": "excluded",
        "delivery": "none",
        "exclusionReasons": [
          "noAuditedIPA",
          "requiresLocalPadMintBuild"
        ],
        "app": null,
        "versions": []
      }
    },
    {
      "id": "bananapad",
      "name": "BananaPad",
      "repository": {
        "slug": "chrissotraidis/bananapad",
        "defaultBranch": "main",
        "revision": "6d2985de0811c352ab9fd885bb838555234bca83",
        "checkoutDirectory": "bananapad",
        "checkoutPolicy": "default",
        "submodules": "none"
      },
      "technical": {
        "status": "manualBuild",
        "note": "Current public release contains a PadMint recipe only; users generate their own app from their own Donkey Kong 64 ROM."
      },
      "legal": {
        "spdxExpression": "GPL-3.0",
        "distributionReview": "upstreamLinkOnly",
        "rehostAllowed": false,
        "note": "No rehosting approval. Keep any future release linked to the project owner after source, artwork, trademark, and game-data review."
      },
      "build": {
        "state": "manual",
        "recipe": null,
        "runner": "manual/local",
        "brewPackages": [],
        "expectedBundleIdentifier": null
      },
      "altStore": {
        "status": "excluded",
        "delivery": "none",
        "exclusionReasons": [
          "noAuditedIPA",
          "requiresLocalPadMintBuild"
        ],
        "app": null,
        "versions": []
      }
    },
    {
      "id": "barrelpad",
      "name": "BarrelPad",
      "repository": {
        "slug": "chrissotraidis/barrelpad",
        "defaultBranch": "main",
        "revision": "e05f8820d9b156a23ce4745417335cb69e25394a",
        "checkoutDirectory": "barrelpad",
        "checkoutPolicy": "default",
        "submodules": "recipe"
      },
      "technical": {
        "status": "manualBuild",
        "note": "A device app can be built, but there is no reviewed IPA release recipe."
      },
      "legal": {
        "spdxExpression": "NOASSERTION",
        "distributionReview": "blocked",
        "rehostAllowed": false,
        "note": "No repository-wide outbound grant has been established."
      },
      "build": {
        "state": "manual",
        "recipe": null,
        "runner": "macos-15",
        "brewPackages": [],
        "expectedBundleIdentifier": null
      },
      "altStore": {
        "status": "excluded",
        "delivery": "none",
        "exclusionReasons": [
          "noAuditedIPA",
          "distributionPermissionRequired"
        ],
        "app": null,
        "versions": []
      }
    },
    {
      "id": "bearbirdpad",
      "name": "BearBirdPad",
      "repository": {
        "slug": "chrissotraidis/bearbirdpad",
        "defaultBranch": "main",
        "revision": "e29350e4b12603599c357f736586be00d9492617",
        "checkoutDirectory": "bearbirdpad",
        "checkoutPolicy": "default",
        "submodules": "recipe"
      },
      "technical": {
        "status": "ciStubOnly",
        "note": "Current public CI proves a ROM-free simulator stub, not a releasable device app recipe."
      },
      "legal": {
        "spdxExpression": "GPL-3.0-or-later",
        "distributionReview": "approvedForDirectLink",
        "rehostAllowed": false,
        "note": "Generated game-code and frontend redistribution boundaries remain under review."
      },
      "build": {
        "state": "manual",
        "recipe": null,
        "runner": "macos-15",
        "brewPackages": [],
        "expectedBundleIdentifier": null
      },
      "altStore": {
        "status": "excluded",
        "delivery": "none",
        "exclusionReasons": [
          "upstreamIPAWithdrawn"
        ],
        "app": {
          "name": "BearBirdPad",